,뉴스제목,신문사,기자,입력시간,뉴스기사,url
0,"  '피도 눈물도 없이' 하연주, 거짓 미투 계획..양혜진 벼랑 끝  ",OSEN,장우영,2024. 2. 6. 08:08,"[OSEN=장우영 기자] ‘피도 눈물도 없이’ 하연주가 이소연에 대한 분노에 사로잡혀 폭주했다.5일 방송된 KBS2 일일드라마 ‘피도 눈물도 없이’(극본 김경희, 연출 김신일 최정은, 제작 몬스터유니온) 11회에서는 이혜원(이소연)의 경고에도 불구하고 배도은(하연주)이 오수향(양혜진)의 갤러리 소속 작가인 임단웅(서태혁)의 약점을 이용, 수향을 벼랑 끝으로 몰아세웠다.이날 방송은 혜원이 도은의 머리에 짬뽕 국물을 쏟고, 컵을 던지는 임팩트 있는 모습으로 시작됐다. 이어 혜원은 “네가 바닥을 보이면 난 그 바닥을 파서 밑바닥까지 갈 거야”라고 도은을 도발했고, 집에 도착한 도은은 분이 삭히지 않는 듯 포크로 케이크를 난도질하며 그녀를 저주했다. 열이 끝까지 오른 도은은 특히 혜원과 수향의 사진을 보며 “누가 보면 모녀지간인 줄 알겠네. 이혜원, 정신 차려. 네 엄마는 시궁창 밑바닥 인생 피영주야”라고 분노를 표출했다.이후 전경자(신하랑)를 만난 도은은 그녀에게 수향의 갤러리 소속이자 그녀가 아끼는 작가 단웅이 현재 엄청난 빚으로 불행을 겪고 있단 소식을 들었다. 단웅을 이용하기로 마음먹은 도은은 그에게 연락해 거부할 수 없는 조건을 제시했다. 도은을 만난 단웅은 수향을 배신할 수 없다며 제안을 거부했지만, 과거 마약에 손을 댔다는 약점까지 잡히면서 도은의 제안을 어쩔 수 없이 받아들였다. 단웅의 제안 수락에 도은은 수향이 단웅에게 성접대를 하게 했다는 미투 사건을 계획했다.한편 혜원과 시할머니인 김명애(정혜선)는 거실에서 함께 마작을 뒀고, 명애는 혜원에게 “너는 네 시애미나 시아버지 중에 버릴 패가 뭐라고 생각하냐”라고 질문을 던졌다. 명애는 혜원이 곤란해하며 답을 하지 않자 “몇 달 동안 규칙이나 깨칠 정도면, 지능을 의심해 봐야지”라고 마작을 못 하는 혜원을 무시하는 등 보는 이들의 안타까움을 자아냈다.방송 말미 지창과 수향은 도은이 계획한 미투 사건을, 뉴스를 통해 접했다. 지창은 엄마의 미투 사건 속보에 들고 있던 소주까지 떨어뜨리며 말할 수 없는 충격에 휩싸였다. 수향 또한 충격과 당황스러움을 금치 못하는 엔딩이 펼쳐지면서 다음 방송을 더욱 기대하게 만들었다.KBS2 일일드라마 ‘피도 눈물도 없이’ 12회는 6일 저녁 7시 50분 방송된다. /elnino8919@osen.co.kr",http://v.daum.net/v/20240206080831831
